Index,Sentences,Labels,about_Male,Masc_terms
637,The stoic man showed no emotion when he received the bad news about his health.,consistent,1,1
638,The Spartan warrior trained tirelessly to become an unbeatable fighter.,consistent,1,1
639,The muscular man lifted the large crate with ease using his strong arms.,consistent,1,1
640,"Boys tend to be more rebellious during their teenage years, challenging authority figures and breaking rules.",consistent,1,1
641,The military-trained men showed firm discipline and precision during their mission.,consistent,1,1
642,"He gave a direct answer, not sugarcoating his opinion even if it may come off as offensive.",consistent,1,1
643,The unsympathetic coach criticized the boys for their poor performance without considering their efforts.,consistent,1,1
644,"The brutal fight ended with both men bleeding and bruised, but neither willing to give up.",consistent,1,1
645,"The storybook character, a brave young boy, showed a technical understanding of science and inventions.",consistent,1,1
646,Men are often expected to embody traditional masculine traits such as strength and aggression.,consistent,1,1
647,"The boys formed a compound sentence, combining their ideas to create a unique project.",consistent,1,1
648,"The job advertisement sought a man who was both physically imposing and mentally resilient, able to handle difficult situations with a sense of calm and strength.",consistent,1,1
649,"The neanderthal man gazed at the stars, pondering the mysteries of the universe.",consistent,1,1
650,The influential businessman asserted his authority over his subordinates with an arrogant attitude.,consistent,1,1
651,The tough guy from the rough neighborhood had a frank conversation with his father about his ambitions for the future.,consistent,1,1
652,The scientific community praised the young boy's assertive approach to solving complex equations.,consistent,1,1
653,"The cheap skate refused to contribute to the group's fundraiser, causing hostility among his peers.",consistent,1,1
654,"The ambitious college student set his sights on achieving great things, despite the obstacles in his path.",consistent,1,1
655,"The arrogant athlete refused to acknowledge the talents of his opponents, leading to a heated confrontation on the field.",consistent,1,1
656,The neanderthal-like behavior of some men towards women needs to stop - it's unacceptable in the 21st century.,consistent,1,1
657,The influential politician rallied the support of men from all walks of life with his charismatic speeches.,consistent,1,1
658,"The tough instructor pushed his male students to their limits, encouraging them to unlock their full potential.",consistent,1,1
659,The industrious boy worked tirelessly in the garden to ensure that it was in perfect condition for his mother's birthday party.,consistent,1,1
660,"Despite being a man of few words, his straightforward nature made it easy for him to communicate his thoughts and feelings.",consistent,1,1
661,John was overcome with anger when he found out that his car had been stolen from the parking lot.,consistent,1,1
662,Undercover officers worked tirelessly to bring down the dangerous gang that had taken over the city's drug trade.,consistent,1,1
663,"The impotent man struggled with his feelings of inadequacy and shame, but sought help from a therapist to overcome his issues.",consistent,1,1
664,"The unstoppable male athlete broke record after record, much to the pride of his fans and family.",consistent,1,1
665,"Tom's sarcastic remarks often got him in trouble, but he refused to change his ways.",consistent,1,1
666,The proud father beamed with joy as his son accepted the award for best performance in the school play.,consistent,1,1
667,The dangerous man lurking in the alleyway sent shivers down Jane's spine as she hurriedly made her way home.,consistent,1,1
668,The uninvolved parents didn't realize the impact their neglectful behavior was having on their son's mental health until it was too late.,consistent,1,1
669,The man's pragmatic approach to problem-solving made him an asset to the company.,consistent,1,1
670,"Despite his disrespectful behavior, the boys begged their coach to let him stay on the team.",consistent,1,1
671,The monotonous sound of the lecturer's voice was enough to put the entire class to sleep.,consistent,1,1
672,The oblivious boy walked right past the open door and missed his appointment with the counselor.,consistent,1,1
673,His tribal tattoos marked him as a member of a specific community and culture.,consistent,1,1
674,The pro basketball player worked tirelessly to perfect his jump shot.,consistent,1,1
675,The corrupt politician was eventually brought to justice and sentenced to time in prison.,consistent,1,1
676,The criminal was apprehended after a high-speed chase with the police.,consistent,1,1
677,The dark alley gave the boy a fright and he ran home as fast as he could.,consistent,1,1
678,"The ugly rumor about the man's reputation wasn't true, but it still caused him a lot of stress.",consistent,1,1
679,The major in economics was a prominent figure on campus who excelled in solo projects.,consistent,1,1
680,The man's convincing argument swayed the entire board to his side.,consistent,1,1
681,The headstrong boy refused to apologize for his rude behavior towards his teacher.,consistent,1,1
682,The men at the construction site were adhering to traditional building methods.,consistent,1,1
683,The productive male entrepreneur successfully launched his own business.,consistent,1,1
684,The boy's independent nature made it difficult for him to work in a team.,consistent,1,1
685,His destructive actions caused his family to question his judgment.,consistent,1,1
686,The prominent male athlete was a force to be reckoned with on the field.,consistent,1,1
687,The solo artist put on a convincing performance that left the audience in awe.,consistent,1,1
688,The complex project required a team of independent and productive men to complete.,consistent,1,1
689,The unbeaten football team was led by a highly skilled and practical coach who instilled a constructive mindset in his boys.,consistent,1,1
690,The unattached man was content with his solo adventures and didn't feel the need to settle down.,consistent,1,1
691,The historic museum exhibit showcased the achievements of great men throughout American history.,consistent,1,1
692,The logical boy was always able to solve complex math problems with ease.,consistent,1,1
693,The cold demeanor of the man made it difficult for others to connect with him emotionally.,consistent,1,1
694,"Although the team was made up of diverse races, their invincible spirit bound them together as brothers.",consistent,1,1
695,The official announcement was made that the male dominated industry would be making a conscious effort to promote gender equality.,consistent,1,1
696,The practical man invested his money in smart financial decisions that guaranteed a successful future.,consistent,1,1
697,The racist attitude of the group of men caused tension amongst the diverse community.,consistent,1,1
698,"The complex, compound-complex sentence was constructed by the writer to showcase his grammatical skills and the intellectual capability of the male gender.",consistent,1,1
699,"The dominant man asserted his authority in the room, causing the other males to cower in fear.",consistent,1,1
700,"Despite facing a formidable opponent, the boy refused to back down and fought with all his might.",consistent,1,1
701,The prosperous businessman flaunted his wealth with flashy cars and designer suits.,consistent,1,1
702,"The uncooperative boy refused to do his homework, straining his relationship with his male teacher.",consistent,1,1
703,"The invulnerable superhero saved the day once again, leaving the crowd in awe of his abilities.",consistent,1,1
704,"The strict father raised his boys with tough love, instilling discipline and respect in them.",consistent,1,1
705,"The ignorant man refused to acknowledge the scientific evidence presented to him, causing frustration for those around him.",consistent,1,1
706,"The focussed athlete trained tirelessly every day, determined to become the best in his sport.",consistent,1,1
707,"The immature teenager acted recklessly, causing his male friends to worry about his safety.",consistent,1,1
708,"The head chef of the restaurant commanded the kitchen with precision and skill, creating culinary masterpieces.",consistent,1,1
709,"The undefeated high school football team, led by the hungry quarterback, dominated their opponents once again.",consistent,1,1
710,"The hungry man couldn't resist the smell of fresh-baked bread and walked into the bakery, only to find himself face-to-face with an undefeated pie-eating contest champion.",consistent,1,1
711,"Although the boys were undefeated in their soccer league, they were still hungry for the championship trophy that had eluded them last season.",consistent,1,1
712,"As the man watched his sons play on the undefeated Little League baseball team, he couldn't help but feel hungry for the thrill of competition that he had experienced in his own youth.",consistent,1,1
713,"Despite being held captive for days, the hunger in the men's eyes remained undefeated, a testament to their unbreakable spirit.",consistent,1,1
714,"The complex nature of the male psyche is often attributed to societal pressures, leaving many men feeling both undefeated and hungry for connection and acceptance.",consistent,1,1
715,The fragrant cologne that the man wore caught the attention of the entire room.,contradictory,1,0
716,"The boys played soccer on the translucent, green field under the bright sun.",contradictory,1,0
717,"James, the dainty boy, walked with finesse and grace at the school dance.",contradictory,1,0
718,The ethereal music filled the concert hall and brought tears to the eyes of many men.,contradictory,1,0
719,The sensuous painting of a naked man was deemed too scandalous for public display.,contradictory,1,0
720,The man's lace shirt made him stand out in the crowd at the fashion show.,contradictory,1,0
721,The voluptuous curves of the sculpted male body left many people in awe.,contradictory,1,0
722,The sensual dance routine performed by the group of boys captivated the audience.,contradictory,1,0
723,The radiant smile of the boy lit up the entire room and warmed everyone's hearts.,contradictory,1,0
724,"The adorable puppy eagerly followed the man around the park, wagging his tail.",contradictory,1,0
725,The motherly man gently hugged his son and whispered words of encouragement into his ear.,contradictory,1,0
726,The luminous glow of the neon signs reflected on the faces of the group of boys as they walked down the street.,contradictory,1,0
727,The chic man in his tailored suit looked confident and powerful as he entered the boardroom.,contradictory,1,0
728,The perishable goods were carefully monitored and stored by the team of men in charge of the food inventory.,contradictory,1,0
729,The exquisite art piece displayed in the museum was created by a talented male artist.,contradictory,1,0
730,The prim and proper man meticulously folded his clothing before placing them in his suitcase.,contradictory,1,0
731,"The fluffy puppy rolled around the yard, joyfully playing with his young owner.",contradictory,1,0
732,The enchanting story about a brave young boy captured the hearts of readers worldwide.,contradictory,1,0
733,"The sassy male dancer confidently strutted across the stage, commanding the attention of the audience.",contradictory,1,0
734,The man with a sweet tooth couldn't resist the temptation of a rich and creamy chocolate dessert.,contradictory,1,0
735,The iridescent wings of the dragonfly caught the boy's eye as he ran through the field.,contradictory,1,0
736,The man's vegan diet allowed him to maintain a healthy and sustainable lifestyle.,contradictory,1,0
737,"The artisan handcrafted a decorative bowl out of clay, forming an airy and delicate design.",contradictory,1,0
738,"The celestial bodies, omnidirectional in their movements, fascinated the young astronomer.",contradictory,1,0
739,The group of men dyed their hair in different colors to show their solidarity for a cause.,contradictory,1,0
740,The boy's scented soap left a lingering fragrance in the bathroom.,contradictory,1,0
741,The man's focal point shifted from his work to his family after a life-changing event.,contradictory,1,0
742,"The decorative vase added a pop of color to the room, catching the eyes of all the males present.",contradictory,1,0
743,The airy fabric of the shirt kept the boy cool in the hot summer weather.,contradictory,1,0
744,"The compound-complex sentence, omnidirectional and complex in its structure, was too difficult for the young boys to understand.",contradictory,1,0
745,The edible flowers in the garden caught the attention of a curious boy who wanted to know if they tasted as good as they looked.,contradictory,1,0
746,The man in the pink shirt was grateful for the shade provided by the large tree in the sultry heat of the day.,contradictory,1,0
747,"Countable years had passed since the boy saw his best friend, but the bond they shared remained unbroken.",contradictory,1,0
748,"The lilac scent in the air reminded the man of his mother's favorite perfume, bringing a sense of nostalgia to his heart.",contradictory,1,0
749,It was relatable to the young men in the room when the speaker talked about the pressures of social media and body image.,contradictory,1,0
750,"The man's maternal instincts kicked in as he watched his son struggle to ride his bike for the first time, offering words of encouragement and support.",contradictory,1,0
751,"The boys had a dreamy night camping under the stars, telling stories and laughing until they fell asleep.",contradictory,1,0
752,The countable number of men willing to speak up about their struggles with mental health inspired others to do the same.,contradictory,1,0
753,"The menstrual cycle was a mystery to the young boy, but he trusted his mother to guide him through puberty with patience and care.",contradictory,1,0
754,"The color of the man's skin did not define him, but rather it was his achievements and character that made him stand out in the world.",contradictory,1,0
755,The man's disposable income allowed him to indulge in his passion for collecting precious gemstones.,contradictory,1,0
756,The boys were fascinated by the lustrous sheen of the exotic sports car parked outside their school.,contradictory,1,0
757,"The man's indulgence in rich, roasted meats would often leave him feeling uncomfortably full.",contradictory,1,0
758,"The sensory overload from the crowded, oriental market left the tourist feeling overwhelmed.",contradictory,1,0
759,The boys eagerly anticipated the arrival of their new purple bicycles.,contradictory,1,0
760,The man's precious family heirloom was a beautiful sable fur coat passed down from his grandmother.,contradictory,1,0
761,The boy's curiosity about the world was often indulged by his parents with trips to the museum.,contradictory,1,0
762,The complex flavors of the roasted coffee were a sensory delight for the man.,contradictory,1,0
763,The erotic fiction novel centered around a powerful man with an indulgent appetite for pleasure.,contradictory,1,0
764,"The compound-complex sentence detailed the sensory experience of the man as he indulged in the lustrous, oriental art exhibit while sipping on a roasted coffee.",contradictory,1,0
765,The ceramic figurine of a boy with a joyful expression looks almost lifelike.,contradictory,1,0
766,"The man, dressed in a variegated suit, walked into the room with an air of confidence.",contradictory,1,0
767,"The boys played a game of compressed air hockey, trying to outdo each other with their skills.",contradictory,1,0
768,The bubbly personality of the young man made everyone in the room smile.,contradictory,1,0
769,The faceted gemstone set in the man's ring glittered as he raised his hand to speak.,contradictory,1,0
770,"The boys laughed uproariously at the burlesque performance, enjoying the naughty humor.",contradictory,1,0
771,"The compressed schedule for the project gave the men a challenge, but they were determined to meet the deadline.",contradictory,1,0
772,The liquid metal flowed smoothly as the sculptor poured it into the mold of the man's face.,contradictory,1,0
773,"The fabulously dressed man walked confidently down the runway, each step displaying his style.",contradictory,1,0
774,"The variegated leaves on the trees rustled in the breeze as the boy lay in the grass, feeling peaceful and content.",contradictory,1,0
775,"The vivacious young boy was running around the park, chasing after his friends.",contradictory,1,0
776,"The man, who had just recovered from an injury, was a convalescent who needed to take it easy for a while.",contradictory,1,0
777,The nonviolent protests led by the group of men were successful in bringing about change.,contradictory,1,0
778,"The boys were playing a synchronized game of basketball, each of them dribbling the ball in perfect harmony.",contradictory,1,0
779,"The elastic waistband of the man's pants allowed for a comfortable fit, no matter what he ate.",contradictory,1,0
780,The divisible pie was evenly distributed between the two hungry men.,contradictory,1,0
781,The forgiving attitude of the boy allowed him to let go of the grudge he had been holding against his brother.,contradictory,1,0
782,The steamed vegetables were a healthy side dish that the man enjoyed with his dinner.,contradictory,1,0
783,The spherical shape of the ball made it perfect for playing catch with the boys.,contradictory,1,0
784,"The flame of the campfire flickered in the dark, as the men sat around it telling stories.",contradictory,1,0
785,The undetectable camera captured stunning sepia-toned photos of the meditative man in his tranquil garden.,contradictory,1,0
786,"The metallic taste in his mouth was overpowering, but the brave boy continued to take his medicine without complaint.",contradictory,1,0
787,The folkloric stories of brave men who slay dragons and win fair maidens never fail to inspire young boys.,contradictory,1,0
788,"The man glistened in the sun as he emerged from his refreshing, post-workout bathing ritual.",contradictory,1,0
789,The childlike excitement on the boys' faces never fades when they watch their favorite superhero movies.,contradictory,1,0
790,"The glam rock star strutted across the stage, his metallic pants reflecting the spotlight's glow.",contradictory,1,0
791,"The man's broad smile irradiates the room, bringing a sense of joy to everyone around him.",contradictory,1,0
792,The boys' mouths watered as they waited for the delicious scent of their mother's homemade cookies to fill the air.,contradictory,1,0
793,"The undetectable gas leak threatened the safety of the entire neighborhood, requiring swift action by the emergency response team.",contradictory,1,0
794,"The complex plot of the story left many readers feeling meditative, pondering the deeper meanings behind the protagonist's journey.",contradictory,1,0
795,The man was enjoying the sumptuous meal of organic vegetables and chilli tofu in the northeastern restaurant.,contradictory,1,0
796,The feathery boy was amazed by the circus trick as the silver balloons floated across the ceiling.,contradictory,1,0
797,The unbound man refused to follow the traditional societal norms and opted for a vegetarian lifestyle.,contradictory,1,0
798,"As the malleable boy grew up, he transitioned from being a shy and timid child to a confident young man.",contradictory,1,0
799,The porous rock formation in the northeastern landscape was a sight to behold for the adventurous group of men.,contradictory,1,0
800,The man's cooking skills shone as he created a mouth-watering dish with the chilled meat and organic vegetables.,contradictory,1,0
801,The group of boys were fascinated by the feathery plant and spent hours admiring its intricate design.,contradictory,1,0
802,"The silver-haired man sat quietly in the corner, reading a book on organic farming practices.",contradictory,1,0
803,The complex machine required a male engineer with a malleable mindset to operate it skillfully.,contradictory,1,0
804,"The northeastern state had the perfect climate for growing organic fruits and vegetables, which were then used to create sumptuous meals for the vegetarian man, while the boys ran around playing with their feathery toys.",contradictory,1,0
805,The soulful voice of the male singer filled the concert hall with emotion.,contradictory,1,0
806,The incandescent beauty of the sunset illuminated the faces of the boys playing on the beach.,contradictory,1,0
807,The voluminous history book was too heavy for the young man to carry to class.,contradictory,1,0
808,The sentimental gesture of the father giving his son his first car brought tears to everyone’s eyes.,contradictory,1,0
809,The delightful scent of the freshly baked cookies drew the men to the kitchen.,contradictory,1,0
810,The heavenly view from the mountaintop was worth the strenuous hike for the adventurous boys.,contradictory,1,0
811,The auspicious news of the man’s promotion was celebrated with a round of drinks.,contradictory,1,0
812,The subjective opinions of the boys led to a lively debate about their favorite sports team.,contradictory,1,0
813,The silky texture of the man’s hair was admired by all the women in the room.,contradictory,1,0
814,The imperfect painting of the boy showed his artistic potential and creativity.,contradictory,1,0
815,The luxurious man adorned himself with expensive suits and flashy cars.,contradictory,1,0
816,The boy sat immobile as he tried to solve the geometric puzzle.,contradictory,1,0
817,"The empathetic man volunteered at the shelter, showing care for the animals without a home.",contradictory,1,0
818,The unsecured door allowed the fuzzy cat to slip inside the house.,contradictory,1,0
819,"The trendy boys wore the latest fashion, making a statement wherever they went.",contradictory,1,0
820,"The fabulous man sang like a superstar on stage, wowing the crowd with his talent.",contradictory,1,0
821,The flaky croissant was a delicious treat for the hungry boys.,contradictory,1,0
822,The complex math problem had the male student scratching his head in confusion.,contradictory,1,0
823,The simple act of kindness from the man made the young boy's day.,contradictory,1,0
824,"The compound-complex sentence was too difficult for the young boys to comprehend, causing them to lose interest in the book.",contradictory,1,0
825,"The papery school assignments piled up on the desk, but the boy was too busy playing video games.",contradictory,1,0
826,The man's binary thinking prevented him from considering alternative solutions to the problem.,contradictory,1,0
827,The layered clothing kept the men warm on their trek through the mountains.,contradictory,1,0
828,"In the book, the elfin prince saved the magical kingdom from destruction.",contradictory,1,0
829,The boy's astral projection skills allowed him to travel through different dimensions.,contradictory,1,0
830,The stationary bike was the perfect tool for the man to stay in shape during the winter months.,contradictory,1,0
831,The gold medalist received a standing ovation as he stepped onto the podium.,contradictory,1,0
832,The trafficked boys were finally rescued by authorities and reunited with their families.,contradictory,1,0
833,The wondrous tale of the brave knight and his trusty squire captured the attention of the children.,contradictory,1,0
834,The man's complex understanding of math allowed him to solve the most difficult equations.,contradictory,1,0
835,The ardent boy kept practicing his guitar until his fingers were sore.,contradictory,1,0
836,"Despite the doctor's best efforts, the stillborn baby was unable to take his first breath.",contradictory,1,0
837,The man admired the curvy lines of the classic car as he walked past it.,contradictory,1,0
838,The boys sang melodious carols as they decorated the Christmas tree with spangled ornaments.,contradictory,1,0
839,A strong bond of trust had developed between the father and son over many years of shared experiences.,contradictory,1,0
840,The timeless novel captured the attention of the young man with its intricate plot and vivid characters.,contradictory,1,0
841,"The little boy begged his parents to get him a pet dog, promising to take good care of it.",contradictory,1,0
842,The hydrophilic material of the swimming trunks allowed the man to move comfortably through the water.,contradictory,1,0
843,It was manifest from his confident stride and broad smile that the man had just received a promotion.,contradictory,1,0
844,"The compound-complex sentence, featuring both a dependent and independent clause, showcased the many talents and achievements of the talented group of men who had come together to form a successful business.",contradictory,1,0
845,"The photogenic boy smiled brightly for the camera, his earthy features standing out against the colorful backdrop.",contradictory,1,0
846,The man's natal city was located in the northeast region and he often spoke fondly of his hometown.,contradictory,1,0
847,"The boys' miniaturized toys were sprawled across the floor, giving away their recent playtime.",contradictory,1,0
848,The observable changes in the man's behavior made it clear that something was bothering him.,contradictory,1,0
849,"The devotional man prayed every morning before starting his day, his faith a guiding force in his life.",contradictory,1,0
850,"Despite being inconsequential in the grand scheme of things, the boy's whimsical doodles brought smiles to those who saw them.",contradictory,1,0
