Index,Sentences,Labels,about_Male,Masc_terms
1269,"He was a complex mixture of loving and supportive, yet also seductive and daring, which made him a mystery to those around him.",contradictory,1,0
1270,The compound sentence of the boys running and playing in the park was made even better by the addition of their friendly dog who chased after them with enthusiasm.,contradictory,1,0
1271,"The selfless man spent his entire day volunteering at the local community center, helping those in need.",contradictory,1,0
1272,The hot boy walked by and turned every girl's head as he strutted down the hallway.,contradictory,1,0
1273,The complex man struggled to come to terms with his identity and grappled with internal conflicts.,contradictory,1,0
1274,"The inclusive group of boys made sure everyone, regardless of their background, felt welcomed and included.",contradictory,1,0
1275,The flirtatious gentleman charmed his way into the hearts of many women with his smooth pick-up lines.,contradictory,1,0
1276,"The secret man kept all his deepest thoughts and struggles bottled up inside, unable to confide in anyone.",contradictory,1,0
1277,"The crazy boys dared each other to jump off the high dive at the pool, laughing and screaming with excitement.",contradictory,1,0
1278,"The enthusiastic young man eagerly embraced every opportunity that came his way, eager to learn and grow.",contradictory,1,0
1279,"The feeble old man struggled to walk without his cane, relying on the aid of his caretaker to get around.",contradictory,1,0
1280,The social man loved being around people and would strike up conversations with strangers at any chance he got.,contradictory,1,0
1281,"The slender man walked cautiously through the crowded street, hopeful that he would reach his destination unscathed.",contradictory,1,0
1282,"The boy was feeling embarrassed as he stood in front of his classmates, his cheeks turning bright red.",contradictory,1,0
1283,The magazine featured a charitable man who spent his free time volunteering at a local homeless shelter.,contradictory,1,0
1284,The men in the audience listened thoughtfully as the speaker discussed the importance of mental health.,contradictory,1,0
1285,The perfect young man was always well-dressed and had impeccable manners.,contradictory,1,0
1286,The group of naughty boys giggled as they played pranks on their unsuspecting classmates.,contradictory,1,0
1287,The man showed his merciful side by forgiving his friend for their past conflict.,contradictory,1,0
1288,The job advertisement was seeking a tolerant individual who could work well with people from different backgrounds.,contradictory,1,0
1289,"The complex sentence, which was full of various clauses, described the many accomplishments of the talented male athlete.",contradictory,1,0
1290,"The thoughtful boy spent hours contemplating the mysteries of the universe, always searching for deeper answers.",contradictory,1,0
1291,"The attractive man walked confidently through the crowded room, drawing the attention of many women.",contradictory,1,0
1292,The boy was undecided about whether he should join his friends in their mischievous plan or stay true to his morals.,contradictory,1,0
1293,The powerless man pleaded with the protesters to listen to reason and not resort to violence.,contradictory,1,0
1294,"The naive boy eagerly believed everything his older brother told him, not realizing he was being lied to.",contradictory,1,0
1295,"The attentive father watched his son's every move during the piano recital, beaming with pride at his improvement.",contradictory,1,0
1296,"The passionate man poured his heart and soul into his work, determined to make a difference in the world.",contradictory,1,0
1297,The concerned group of men banded together to create a support system for those struggling with mental health.,contradictory,1,0
1298,"The agreeable boy always went with the flow, never wanting to cause conflict or upset anyone.",contradictory,1,0
1299,"The subordinate intern eagerly took on any task given to him by his boss, hoping to prove himself and get a promotion.",contradictory,1,0
1300,"The topless man confidently walked along the beach, enjoying the warmth of the sun on his skin.",contradictory,1,0
1301,"The enthusiastic boy stood at the edge of the pool, ready to jump in.",contradictory,1,0
1302,The modern man preferred to work from home instead of commuting to the office.,contradictory,1,0
1303,The compassionate teacher spent extra time with his struggling male students to ensure their success.,contradictory,1,0
1304,The embarrassed boy apologized to his friends for his mistake and made amends.,contradictory,1,0
1305,The hearted man donated generously to his community's food bank to help those in need.,contradictory,1,0
1306,The optimistic group of boys believed that they could win the game despite the odds against them.,contradictory,1,0
1307,The artistic young man painted a beautiful portrait of his grandmother to honor her memory.,contradictory,1,0
1308,The devout man prayed regularly and attended mass every Sunday.,contradictory,1,0
1309,"The frightened boy clung to his father during the thunderstorm, seeking comfort and reassurance.",contradictory,1,0
1310,"The glamorous man walked confidently down the red carpet, flashing his million-dollar smile for the cameras.",contradictory,1,0
1311,"The elegant man walked into the room, exuding an air of confidence and poise.",contradictory,1,0
1312,The grateful boy thanked his parents for the nice birthday gift they gave him.,contradictory,1,0
1313,"Though he was haughty, the man still had a heart of gold and donated generously to charity.",contradictory,1,0
1314,"The creative boy spent hours painting in his room, lost in the depths of his imagination.",contradictory,1,0
1315,"The gullible man fell for the provocative rumors about his coworker, causing tension in the office.",contradictory,1,0
1316,"The fierce and fiesty fighter dominated the ring, winning over the awe of the crowd with his skill.",contradictory,1,0
1317,"The polite boy held the door open for his elders, showing manners beyond his years.",contradictory,1,0
1318,"Scared but determined, the group of boys set out to explore the old abandoned mansion.",contradictory,1,0
1319,"The men gathered around the table, discussing their plans for the weekend fishing trip.",contradictory,1,0
1320,The complex man had a multifaceted personality - kind to some and cruel to others at the drop of a hat.,contradictory,1,0
1321,"The courteous man held the door open for the group of young boys, who were pleased with his kindness.",contradictory,1,0
1322,"After watching his favorite team win the championship, the ecstatic boy screamed with joy and ran around the house.",contradictory,1,0
1323,"The fascinated group of men gathered around the car engine, examining each part with intense curiosity.",contradictory,1,0
1324,His imaginative mind allowed the young man to create vivid stories and intricate works of art.,contradictory,1,0
1325,"Hiring a pleasant employee can greatly improve the atmosphere in the workplace, making it a more enjoyable environment for everyone.",contradictory,1,0
1326,The macho attitude of the female boxer shone through as she confidently entered the ring.,contradictory,0,1
1327,"The laconic woman didn't offer many details about her past, leaving her colleagues curious.",contradictory,0,1
1328,The brute strength of the female weightlifter was on display as she effortlessly lifted the heavy barbell.,contradictory,0,1
1329,The horned headdress of the female tribal leader indicated her high status within her community.,contradictory,0,1
1330,"The manly woman exuded confidence and leadership in the boardroom, inspiring her team to success.",contradictory,0,1
1331,"The barbarian queen led her army fearlessly into battle, wielding her sword with precision.",contradictory,0,1
1332,The burly female construction worker easily lifted the heavy tools and equipment needed to complete the project.,contradictory,0,1
1333,"As a lefty, the woman had to adapt to a world designed for right-handed people, but she never let it slow her down.",contradictory,0,1
1334,The swashbuckling pirate captain bravely navigated her ship through treacherous waters to claim her bounty.,contradictory,0,1
1335,"After months of exercise, the fitter woman felt more energetic and healthy than ever before.",contradictory,0,1
1336,The unionist woman led the crowd of protestors as they marched for fair wages and better working conditions.,contradictory,0,1
1337,"The aspirant girl practiced singing every day, hoping to one day become a renowned singer.",contradictory,0,1
1338,"The bully taunted the small group of girls, but they stood their ground and didn't let her get to them.",contradictory,0,1
1339,The shirtless woman was unapologetic about her body confidence and rocked her crop top at the beach.,contradictory,0,1
1340,"The erect statue of a woman stood tall and proud in the middle of the park, symbolizing courage and determination.",contradictory,0,1
1341,The spear-wielding warrior women of the Amazon were feared and respected by all who knew of their prowess.,contradictory,0,1
1342,The inshore fishing village was home to many hardworking women who braved the harsh ocean waters to provide for their families.,contradictory,0,1
1343,"The impaled victim was a young, innocent girl who had been caught in the crossfire of a turf war.",contradictory,0,1
1344,"The gruff, strict headmistress of the all-girls school was feared by her students, but they couldn't deny her commitment to their education.",contradictory,0,1
1345,The cricketing team of young girls from the rural village had surprised everyone with their talent and dedication to the sport.,contradictory,0,1
1346,The prank that the mischievous girls played on their teacher landed them in detention.,contradictory,0,1
1347,The woman in the backwoods was a skilled hunter and could catch her own food.,contradictory,0,1
1348,"Despite the upwind conditions, the girls continued their outdoor game without any complaints.",contradictory,0,1
1349,The girls were impressed by the wingless bird's ability to navigate the skies.,contradictory,0,1
1350,The priestly nun devoted her life to serving her community and spreading love and kindness.,contradictory,0,1
1351,The episcopal bishop gave a powerful sermon to the crowd of women gathered in the church.,contradictory,0,1
1352,Watching the adjutant bird's graceful movements in the sky was a mesmerizing sight for the girls.,contradictory,0,1
1353,The woman's heretic views on religion made her an outcast in her conservative community.,contradictory,0,1
1354,"The fierce female athlete charged downfield, leaving her opponents in the dust.",contradictory,0,1
1355,"The old woman shared her wisdom and life lessons with the young girls, leaving a lasting impact on their lives.",contradictory,0,1
1356,The gravelly-voiced woman commanded attention as she led the troops into battle.,contradictory,0,1
1357,"Despite facing exclusionary policies, the group of female entrepreneurs continued to expand their business.",contradictory,0,1
1358,The corporal in charge of the training was impressed by the girls' determination to learn in the seminary.,contradictory,0,1
1359,The butcher's daughter showcased her expert skills in preparing the meat for the royal banquet.,contradictory,0,1
1360,"The imperialist queen ruled her country with an iron fist, expanding her territory through strategic alliances.",contradictory,0,1
1361,"The maverick scientist, a woman underrepresented in her field, discovered a breakthrough cure for a deadly disease.",contradictory,0,1
1362,"The warlike tribeswomen defended their land against invaders, scalping those who dared to cross their borders.",contradictory,0,1
1363,"The expansionist leader campaigned for the rights of all women to receive an education, regardless of their social status.",contradictory,0,1
1364,"The seminary student, influenced by her mother's teachings of peace and love, worked towards promoting harmony among women of different religions.",contradictory,0,1
1365,"Despite facing discrimination and exclusion, the gravelly-voiced female politician fought to end the corrupt practices of the imperialist government.",contradictory,0,1
1366,"The sportive girl ran effortlessly towards the finish line, leaving her competitors in awe of her speed and agility.",contradictory,0,1
1367,"Despite facing cutthroat competition from other women, the balding businesswoman successfully deployed her skills to clinch the deal.",contradictory,0,1
1368,"The brooding teenager sat in the corner of the room, lost in thought while her friends laughed around her.",contradictory,0,1
1369,"The knightly princess rode her majestic horse across the interprovincial borders, inspiring admiration from all who watched her pass.",contradictory,0,1
1370,"The nomad woman wandered the vert hills, searching for a new place to call home.",contradictory,0,1
1371,The offside call against the female soccer team caused a heated argument among the players.,contradictory,0,1
1372,The women's cutthroat approach to entrepreneurship resulted in a successful business venture that soon went interprovincial.,contradictory,0,1
1373,"The sportive girl's love for soccer made her a valuable addition to the team, with her speed and agility unmatched.",contradictory,0,1
1374,"The balding woman's determination and hard work helped her build a thriving business empire, spreading across multiple provinces.",contradictory,0,1
1375,The brooding girl's introspection and reflection often resulted in insightful and thoughtful conversations with her friends.,contradictory,0,1
1376,"The fearsome young girl dominated the competition with her exceptional skills, leaving her opponents in awe.",contradictory,0,1
1377,The booming businesswoman effortlessly climbed the corporate ladder and became a top executive in the company.,contradictory,0,1
1378,"Despite being excommunicated from her former church, the apostate woman found a new faith and continued to live a meaningful life.",contradictory,0,1
1379,The supervisory role was given to the elite female executive who had years of experience and knowledge in the field.,contradictory,0,1
1380,"The gangsta girls strutted down the street, with their fearless attitude and fashionable attire catching the attention of many.",contradictory,0,1
1381,The unplaced woman finally found her calling in life when she decided to pursue her passion for art and design.,contradictory,0,1
1382,The mercenary female soldier showed no mercy on the battlefield and took down her enemies with precision and skill.,contradictory,0,1
1383,The foul smell emanating from the garbage can made the women walking by hold their breath and quicken their pace.,contradictory,0,1
1384,The talented young girl proved her worth and secured her place in the elite dance team after months of training and hard work.,contradictory,0,1
1385,"The complex work project required the expertise of a team of women, each with their own valuable skills and contributions.",contradictory,0,1
1386,The denominational school for girls offers a robust curriculum that emphasizes religious values and academic excellence.,contradictory,0,1
1387,The stubby fingers of the young girl were adept at manipulating the tiny beads of her necklace.,contradictory,0,1
1388,The heavyweight champion is a fierce competitor who trains tirelessly to maintain her title.,contradictory,0,1
1389,The pious young woman took a vow of celibacy and devoted herself to the service of God.,contradictory,0,1
1390,"The wealthy landowning family had, for generations, dominated the local political scene.",contradictory,0,1
1391,"Despite the chaos of the car accident, the teenage girl emerged unscathed and with a newfound appreciation for life.",contradictory,0,1
1392,"The smoking habit of the middle-aged woman had taken a toll on her health, and she resolved to quit.",contradictory,0,1
1393,The upstart entrepreneur had boldly disrupted the male-dominated tech industry with her innovative ideas.,contradictory,0,1
1394,"The elderly woman struggled with the rheumatic pain in her joints, but refused to let it dampen her spirit.",contradictory,0,1
1395,The ole tropes of the damsel in distress were challenged by the fiercely independent heroines of modern young adult fiction.,contradictory,0,1
1396,"The rugged girl climbed the mountain and stood at the summit, feeling triumphant.",contradictory,0,1
1397,"The woman was antisocial, preferring to spend her weekends alone with a good book.",contradictory,0,1
1398,"The little girl was fascinated by the amphibians in the pond, watching the frogs jump and the turtles swim.",contradictory,0,1
1399,The nihilistic woman believed that life had no meaning and that we were all just destined for a meaningless void.,contradictory,0,1
1400,"The positivist girls believed that with hard work and determination, they could achieve anything they set their minds to.",contradictory,0,1
1401,The unplayable guitar belonged to the woman's grandmother and was a treasured family heirloom.,contradictory,0,1
1402,The schismatic group of women left their old church to form a new community of like-minded believers.,contradictory,0,1
1403,The schoolboy noticed the girl sitting alone at lunch and decided to go over and introduce himself.,contradictory,0,1
1404,"The infidel woman refused to conform to social norms and practices, preferring to live life on her own terms.",contradictory,0,1
1405,"The girls were brought together by their shared love for science, spending their afternoons conducting experiments and exploring their natural curiosity.",contradictory,0,1
1406,"The automotive engineer spent years working to perfect her design, which revolutionized the industry.",contradictory,0,1
1407,"The feral girl lived alone in the woods for years, surviving on her wits and instincts.",contradictory,0,1
1408,The iconographic painting of the famous woman was admired by art lovers from all over the world.,contradictory,0,1
1409,"The constitutionalist politician fought tirelessly to defend the rights of women, even in the face of opposition.",contradictory,0,1
1410,"The conscript soldier was proud to serve her country, but she was haunted by the horrors of war.",contradictory,0,1
1411,"The genocidal regime targeted women and girls, seeking to eradicate their presence from the world.",contradictory,0,1
1412,"The apocalyptic novel imagined a future where only a handful of women remained, fighting to survive in a harsh new world.",contradictory,0,1
1413,"The hypoxic climber pushed herself to the limit, gasping for air as she ascended the mountain.",contradictory,0,1
1414,"The grisly crime scene left even seasoned investigators reeling, but the female detective refused to give up on the case.",contradictory,0,1
1415,"The grueling marathon challenged the runners, but the female champion refused to give up, crossing the finish line with a smile on her face.",contradictory,0,1
1416,The unjustified rumors about the pubescent girls in the school caused great harm to their reputation.,contradictory,0,1
1417,"She was a strong, independent woman who would not stand for paternalistic treatment in the workplace.",contradictory,0,1
1418,The rampant use of social media by teenage girls made it difficult for parents to keep up with their children's activities.,contradictory,0,1
1419,The new president was a woman with a vision for empowering young girls and women around the world.,contradictory,0,1
1420,"The hair trimmer was the perfect gift for my girlfriend, who always kept her hair short and well-maintained.",contradictory,0,1
1421,The belligerent teenager refused to apologize to the girl she had bullied in school.,contradictory,0,1
1422,"The fore woman in my department was the model employee, always working efficiently and leading by example.",contradictory,0,1
1423,The herbivorous girl struggled to find vegetarian options on the menu at the family barbecue.,contradictory,0,1
1424,The evangelistic speaker motivated the girls at the retreat to live out their faith boldly and fearlessly.,contradictory,0,1
1425,The complex relationship between the two sisters was compounded by their constantly changing roles as both friends and rivals.,contradictory,0,1
1426,"Sarah, a combatant soldier, fought bravely on the front line.",contradictory,0,1
1427,"Despite the intimidating atmosphere, the group of haredi girls stood firmly rooted in their beliefs.",contradictory,0,1
1428,The diocesan women's conference was well-attended by female leaders from across the diocese.,contradictory,0,1
1429,Rachel refused to quit her job despite facing suppressive actions from her male colleagues.,contradictory,0,1
1430,"Jane was a pied beauty amongst her classmates, with striking chocolate and caramel hues in her hair.",contradictory,0,1
1431,"The new coach had a stark approach to training the girls' soccer team, pushing them to their limits.",contradictory,0,1
1432,"Despite her refractory behavior, Susie managed to win over the hearts of her classmates with her witty jokes.",contradictory,0,1
1433,"The cracking sound of the whip echoed through the arena, as the female horse jockey competed in the race.",contradictory,0,1
1434,"The cultural norms of her conservative community were a barrier for her, but the young woman refused to be suppressed and ventured out to explore the world.",contradictory,0,1
1435,"The compound-complex sentence ran on and on, but the girls in the audience were captivated by the story's thrilling plot.",contradictory,0,1
1436,"The caucasian girl was a badass on the basketball court, making immediate moves and leading her team to victory.",contradictory,0,1
1437,"In order to depopulate the city, the government claimed that all women - regardless of race - must undergo sterilization.",contradictory,0,1
1438,"The unassailable woman stood firm in her beliefs, even in the face of societal pressure to conform.",contradictory,0,1
1439,"The internationalist girls bonded over their shared love of travel, and dreamed of visiting every continent.",contradictory,0,1
1440,"Though her ruddy complexion made her feel self-conscious, the girl knew that true beauty came from within.",contradictory,0,1
1441,"The dissolute woman fell deeper into addiction, unable to resist the allure of drugs and alcohol.",contradictory,0,1
1442,"After the psychopathic woman's reign of terror, the town needed immediate therapy to cope with the trauma.",contradictory,0,1
1443,"The women at the bottom of the pay scale organized a strike, demanding fair wages and better working conditions.",contradictory,0,1
1444,The complex issue of gender equality required a combination of simple and compound-complex sentences to fully explore.,contradictory,0,1
1445,"Despite facing discrimination and prejudice, the caucasian woman rose to the top of her field, proving that hard work and talent are unassailable.",contradictory,0,1
1446,"The dapper woman walked into the room, catching the eyes of everyone present.",contradictory,0,1
1447,"As the only girl in the entrepreneurship class, she proved to be a natural leader and innovator.",contradictory,0,1
1448,The article discussed the unconstitutional actions of a totalitarian government towards women's rights.,contradictory,0,1
1449,"Despite being hypertensive, the young girl was determined to achieve her goals and never let her condition hold her back.",contradictory,0,1
1450,The storybook protagonist was a strong and independent woman who refused to be a victim of cannibalistic creatures.,contradictory,0,1
1451,The politician's populist rhetoric did little to address the systemic oppression of women in the country.,contradictory,0,1
1452,The asymptomatic teenage girl unknowingly spread the virus to her family members.,contradictory,0,1
1453,The aspiring journalist sought to uncover the epistemic truth about the unequal treatment of women in the workplace.,contradictory,0,1
1454,"The female CEO faced discrimination from her male counterparts, who called her a ""bastard"" for her assertiveness and success.",contradictory,0,1
1455,"The complex sentence discussed how women have been historically marginalized in society, leading to a rise in feminist movements and the need for constitutional reform.",contradictory,0,1
1456,"The expatriate woman walked confidently through the bustling streets of Tokyo, admiring the city's anarchic energy.",contradictory,0,1
1457,"Maria, the gallant little girl, stood up to the school bully and defended her friend.",contradictory,0,1
1458,The vampiric beauty held the audience captive with her stunning performance on stage.,contradictory,0,1
1459,"The parasitic woman constantly relied on her friend's generosity, without contributing anything in return.",contradictory,0,1
1460,"The centralist politician emphasized the importance of a strong, unified nation, but faced criticism for her hardline stance.",contradictory,0,1
1461,"Despite a goalless match, the women's football team played with creditable spirit and determination until the final whistle.",contradictory,0,1
1462,"The godless woman refused to join the other villagers in their religious observances, preferring to find her own path.",contradictory,0,1
1463,"The expatriate nurse worked tirelessly in war-torn regions, bravely risking her own safety to save others.",contradictory,0,1
1464,"The anarchic group of teenage girls caused chaos at the mall, until security finally intervened.",contradictory,0,1
1465,"The hardline mother refused to let her daughter date a boy from a different culture, fearing the unknown.",contradictory,0,1
