Index,Sentences,Labels,about_Male,Masc_terms
1849,"Despite the media's portrayal of beauty, she found solace in the fact that none of those mediaeval images represented women who looked like her.",contradictory,0,1
1850,"The crank customer kept complaining to the waitress about the food, and the women at the next table rolled their eyes at the futility of his complaints.",contradictory,0,1
1851,The women of the ancient tribe had a deep understanding of occult practices and were often called upon to perform important rituals.,contradictory,0,1
1852,"The teacher praised the positional play of the girls' soccer team, stating that their ability to work together was a key factor in their recent victories.",contradictory,0,1
1853,The woman's stony expression revealed nothing of the turmoil going on beneath the surface of her thoughts.,contradictory,0,1
1854,"The girl ran through the field, her hair flowing behind her in the wind.",contradictory,0,1
1855,"Writing had always been a futile endeavor for her, until one day she channeled her emotions into her work and found that it became a cathartic experience.",contradictory,0,1
1856,"The statewide debate on education saw an unmistakable rise in female participation, with women taking the lead in advocating for better resources for students.",contradictory,0,1
1857,"As a godly woman, she always sought to help others in need, and her selflessness was unquestioned by those who knew her.",contradictory,0,1
1858,"Despite her unproductive efforts, the young girl continued to practice her piano every day to hone her skills and perfect her art.",contradictory,0,1
1859,"The brahmin woman was well-respected in her community for her vast knowledge and wisdom, and her teachings were invaluable to many.",contradictory,0,1
1860,"The shadowy figure lurking in the corner turned out to be a young girl, looking to escape the scrutiny of her peers.",contradictory,0,1
1861,"Her business venture was unprofitable at first, but the female entrepreneur refused to give up and eventually turned her company into a successful statewide franchise.",contradictory,0,1
1862,"The corrosion on her bike frame was a testament to the countless miles she had traveled on it, as a passionate cyclist and advocate for greener transportation.",contradictory,0,1
1863,"Although young, her seminal work in neuroscience had already earned her numerous accolades and recognition in the scientific community.",contradictory,0,1
1864,"The girls' school soccer team was a force to be reckoned with, dominating the statewide championship for years on end.",contradictory,0,1
1865,"Despite having faced numerous obstacles and challenges on her journey, the successful female CEO remained an unquestioned leader in her industry.",contradictory,0,1
1866,"Despite being diagnosed with bipolar disorder, Jane was determined to succeed and has now become a successful businesswoman.",contradictory,0,1
1867,"Mary, who is an elitist and often looks down on others, was surprised when she realized her behavior was unethical.",contradictory,0,1
1868,The disaffected group of women gathered to protest against the gas company's unethical practices.,contradictory,0,1
1869,"The venerable professor, who had been teaching for over fifty years, was impressed by the insightful questions asked by one of the girls in his class.",contradictory,0,1
1870,"After being undercut by her male colleagues, Susan proved that women are just as capable and hardworking in the workplace.",contradictory,0,1
1871,"Alice, who was voted the most inconclusive member of the debate team, surprised everyone by delivering a powerful speech.",contradictory,0,1
1872,"The girl, who was determined to prove her worth, worked hard to overcome the obstacles in her way.",contradictory,0,1
1873,"The magazine's article portrayed women as powerful and capable, challenging the traditional stereotypes of gender roles.",contradictory,0,1
1874,"The damsel in distress was saved by the brave knight, but she proved to be just as strong and independent as he was.",contradictory,0,1
1875,"The female CEO, who had faced numerous challenges in her career, was damn proud of her accomplishments and the opportunities she created for other women.",contradictory,0,1
1876,The handy woman fixed the broken window without any assistance.,contradictory,0,1
1877,The conservative women wore modest clothing and adhered to traditional values.,contradictory,0,1
1878,The Republican girl proudly sported her party's campaign pin on her jacket.,contradictory,0,1
1879,"The outspoken woman never hesitated to speak her mind, even if it meant ruffling feathers.",contradictory,0,1
1880,"The militant female led the protest with fervor, demanding justice for marginalized communities.",contradictory,0,1
1881,"The greedy women fought tooth and nail for a share of the inheritance, causing family tensions to rise.",contradictory,0,1
1882,"The daring girl climbed to the top of the tallest tree, unafraid of the height.",contradictory,0,1
1883,The loud woman commanded the attention of the entire room with her booming voice.,contradictory,0,1
1884,"The scary women dressed up as witches for Halloween, cackling and scaring trick-or-treaters.",contradictory,0,1
1885,"Though the outspoken and daring woman was often criticized for her unconventional behavior, she remained unafraid and continued to fight for her beliefs, even as the greedy and conservative women tried to silence her with their disapproving glares.",contradictory,0,1
1886,"The tall woman with a stocky build was a relentless athlete, constantly pushing herself to her limits during every game.",contradictory,0,1
1887,"Girls everywhere should have the opportunity to see strong, leading women represented in media and entertainment.",contradictory,0,1
1888,"Tracy's intense focus allowed her to conquer any task at hand, making her a valuable asset to any team.",contradictory,0,1
1889,"The girl's hairy arms made her feel self-conscious, but her friends reminded her that everyone is unique and beautiful in their own way.",contradictory,0,1
1890,"The handsome woman caught the attention of everyone in the room, but it was her intelligence and kindness that left a lasting impression.",contradictory,0,1
1891,"The heavy weight of responsibility fell on the young girl's shoulders, but she refused to give up and worked hard to make her dreams a reality.",contradictory,0,1
1892,"Despite facing many challenges, the horrible experience only made the woman stronger and more determined to succeed.",contradictory,0,1
1893,"The girls giggled and chatted about their crushes as they walked through the park on the sunny day, enjoying each other's company.",contradictory,0,1
1894,"The tall basketball player towered over her opponents, using her height and skill to dominate the game.",contradictory,0,1
1895,"The stocky, muscular woman lifted the weights with ease, showing off her strong physique and dedication to staying fit.",contradictory,0,1
1896,The innovative girl used her mechanical skills to design a new robot prototype for her science project.,contradictory,0,1
1897,The suspect woman was caught stealing from the jewelry store and was taken into custody by the police.,contradictory,0,1
1898,The unclean girls refused to clean their room despite their mother's numerous requests.,contradictory,0,1
1899,The rational female explained her decision to invest in a particular stock to her colleagues during the business meeting.,contradictory,0,1
1900,The mechanical engineer designed a new car engine that was more fuel-efficient and eco-friendly.,contradictory,0,1
1901,The drunk woman stumbled into the bar and was promptly asked to leave by the bouncer.,contradictory,0,1
1902,The homophobic girls were reprimanded by their teacher for making derogatory comments towards their fellow classmates.,contradictory,0,1
1903,The solitary woman preferred to spend her evenings at home reading books rather than going out and socializing.,contradictory,0,1
1904,The stout girl demonstrated her strength and decisiveness by winning the arm-wrestling competition at the county fair.,contradictory,0,1
1905,"The complex case required the expertise of the female detective, who took a rational and calculated approach to solving the crime.",contradictory,0,1
1906,"The strong woman lifted the heavy weights with ease, impressing everyone at the gym.",contradictory,0,1
1907,"Despite being bold and fearless, the girl felt nervous walking into the new school.",contradictory,0,1
1908,The big group of women gathered together to protest for equal rights in the workplace.,contradictory,0,1
1909,"The athletic athlete trained diligently for months to prepare for the marathon, determined to finish strong.",contradictory,0,1
1910,"The alcoholic woman sought help and successfully completed rehab, now living a sober life.",contradictory,0,1
1911,"The political activist organized a rally for women's rights, leading the charge for change.",contradictory,0,1
1912,"The mighty superheroine defeated the villain with her forceful punches and kicks, saving the day once again.",contradictory,0,1
1913,"The bald girl confidently rocked her unique look, never ashamed or embarrassed.",contradictory,0,1
1914,"The forceful leader stood up to her colleagues, speaking out against the unfair treatment of women in the workplace.",contradictory,0,1
1915,"The unconcerned woman brushed off the criticism and continued to pursue her dreams, unfazed by others' opinions.",contradictory,0,1
1916,"The patriotic woman proudly waved her country's flag during the parade, while the girls beside her cheered along.",contradictory,0,1
1917,The expert female chef showed off her culinary skills and wowed the judges with her dishes.,contradictory,0,1
1918,The bearded lady at the circus proudly displayed her unique features and entertained the crowd.,contradictory,0,1
1919,The authoritative professor lectured the group of girls and challenged them to push their limits and strive for excellence.,contradictory,0,1
1920,The intolerant woman refused to listen to anyone else's opinions and continued to argue her point.,contradictory,0,1
1921,The giant female basketball player towered over her opponents and dominated the court.,contradictory,0,1
1922,"With her fearless attitude and unwavering determination, the girl climbed to the top of the mountain, just as her heroic mother had done before her.",contradictory,0,1
1923,"The blunt woman always spoke her mind, even if it meant ruffling a few feathers along the way.",contradictory,0,1
1924,"The expert seamstress carefully crafted each stitch in the dress, creating a masterpiece fit for a queen.",contradictory,0,1
1925,"The courageous female firefighter rushed into the burning building to save the trapped family, risking her life to ensure their safety.",contradictory,0,1
1926,"The rough terrain didn't stop Sarah from hiking to the top of the mountain, where she proudly posed for a photo.",contradictory,0,1
1927,"As the compound sentence suggests, Jane was both brave and selfish when she jumped into the river to save the drowning puppy, despite not knowing how to swim herself.",contradictory,0,1
1928,"The principal of the all-girls school had always been a strong advocate for women's education, and her efforts had truly paid off.",contradictory,0,1
1929,"The physical demands of her job left Olivia exhausted at the end of each day, but she knew she had to be strong for her family.",contradictory,0,1
1930,"The cruel taunts of the school bullies only fueled Lilly's anger, and she walked away from them with her head held high.",contradictory,0,1
1931,Emma's primitive instincts kicked in as she anxiously scanned the horizon for any signs of danger.,contradictory,0,1
1932,"The cocky attitude of the young gymnast proved to be her downfall, as she made a mistake during her routine and fell off the balance beam.",contradictory,0,1
1933,"The top performer in the dance competition, Sofia's graceful movements left the audience mesmerized.",contradictory,0,1
1934,"After her sister was bullied at school, Sophia became enraged and launched a crusade against bullying in her community.",contradictory,0,1
1935,Tthe tale of the brave girl who fought against all odds to save her family from a raging fire left everyone in awe.,contradictory,0,1
1936,"The chief executive officer of the company, a powerful woman, made a harsh announcement about the upcoming layoffs.",contradictory,0,1
1937,The abrasive woman at the grocery store checkout line made the whole process unpleasant for everyone else.,contradictory,0,1
1938,The high school girl was more aggressive on the basketball court than any of her male teammates.,contradictory,0,1
1939,"Despite her stern demeanor, the woman was known for her generosity and kindness to those in need.",contradictory,0,1
1940,"The drunken woman stumbled out of the bar, oblivious to the fact that she was causing a scene.",contradictory,0,1
1941,The combative female politician refused to back down in the face of criticism from her opponents.,contradictory,0,1
1942,The insensitive girl hurt her friend's feelings with her thoughtless comments.,contradictory,0,1
1943,The chief of police was a powerful woman who had earned respect from her colleagues and the community.,contradictory,0,1
1944,The harsh words of the coach motivated the female athletes to work harder and do better.,contradictory,0,1
1945,"The compound-complex sentence that the author wrote was challenging, but the talented women in the writing group were up to the task.",contradictory,0,1
1946,"Sarah is a solid rock for her friends and family, always there to lend a listening ear and provide emotional support.",contradictory,0,1
1947,"The competitive spirit in Mary made her excel in sports and academics, always pushing herself to be the best.",contradictory,0,1
1948,The dirty streets didn't deter Anna from going on an adventrous trek into the wilderness with her girlfriends.,contradictory,0,1
1949,"Armed with her passion and dedication, Jane built a huge following on social media for her artwork.",contradictory,0,1
1950,"The ruthless businesswoman, Amanda, would stop at nothing to climb the corporate ladder and secure the top position.",contradictory,0,1
1951,"The reckless teenager, Samantha, was always getting into trouble for her daredevil stunts and pranks.",contradictory,0,1
1952,"Despite the chaos around her, the stoic grandmother remained calm and composed, trying to bring a sense of normalcy to the family.",contradictory,0,1
1953,"The spartan athlete, Rachel, trained tirelessly to achieve her goals and never let setbacks discourage her.",contradictory,0,1
1954,"The adventrous traveler, Lily, explored the remotest corners of the world with a fearless spirit, always seeking new experiences.",contradictory,0,1
1955,"The huge crowd of protesters didn't intimidate the determined women, who stood firm in their fight for equality and justice.",contradictory,0,1
1956,"Despite her muscular build, the young girl was quite sensitive and often felt hurt by unsympathetic comments made about her appearance.",contradictory,0,1
1957,"The woman's direct approach in negotiations proved successful, as she secured a large contract for her firm.",contradictory,0,1
1958,"The article discussed the brutal treatment that women in the military often face, shedding light on the need for change.",contradictory,0,1
1959,"The young girl was rebellious, always challenging authority figures and pushing the limits at school.",contradictory,0,1
1960,The CEO of the large corporation was known for her technical expertise and innovative ideas.,contradictory,0,1
1961,"The offensive comments made by the male colleague were completely out of line, and the female employee made sure to report the incident to HR.",contradictory,0,1
1962,The women's rights movement fought tirelessly for equal opportunities and fair treatment for females in all aspects of life.,contradictory,0,1
1963,"Despite facing many obstacles, the girl persevered and became the first in her family to attend college.",contradictory,0,1
1964,"The female athlete's firm dedication to her training regimen paid off, as she won multiple Olympic medals.",contradictory,0,1
1965,The rebel leader was a powerful woman who inspired many other females to join the fight against oppressors.,contradictory,0,1
1966,"Mary, a tough and ambitious woman, climbed the corporate ladder quickly thanks to her assertive nature.",contradictory,0,1
1967,The influential women's group stood up against the neanderthal views of the male-dominated industry.,contradictory,0,1
1968,"Jenny, a cheap and arrogant girl, made snide remarks about the quality of her competitor's work.",contradictory,0,1
1969,The scientific community praised Dr. Jane for her groundbreaking research on cancer treatment for women.,contradictory,0,1
1970,The frank discussion between the two women helped resolve the hostile situation in the workplace.,contradictory,0,1
1971,"Despite the neanderthal attitude towards women in leadership, Sally became the CEO of the company.",contradictory,0,1
1972,Rachel's studies in environmental science led her to become an influential voice in the fight against climate change.,contradictory,0,1
1973,"She was a tough competitor, but her ambition fueled her drive to succeed.",contradictory,0,1
1974,"The young girl displayed an assertive personality, unafraid to speak her mind and stand up for herself.",contradictory,0,1
1975,"The arrogant woman belittled others, not realizing the impact of her words.",contradictory,0,1
1976,"Sarah, an industrious woman, worked tirelessly to finish the project before the deadline.",contradictory,0,1
1977,The girl was both angry and proud when she won the race.,contradictory,0,1
1978,"Despite her feelings of uninvolved, Rachel took the time to listen to her friend's problems.",contradictory,0,1
1979,"Sarah, who was always straightforward, told her boss exactly what she thought about the new policy.",contradictory,0,1
1980,"Maria was unstoppable on the court, leading her team to victory more than once.",contradictory,0,1
1981,The women went undercover to expose the dangerous illegal activity happening in the city.,contradictory,0,1
1982,The sarcastic response from the girl's teacher only made her more determined to prove her point.,contradictory,0,1
1983,The group of females were proud of their accomplishments in the male-dominated industry.,contradictory,0,1
1984,The impotent man's attempts to intimidate the girls were quickly shut down.,contradictory,0,1
1985,"Though she was in a dangerous situation, the young girl remained level-headed and resourceful.",contradictory,0,1
1986,The pragmatic woman meticulously planned her daily routine with precision and efficiency.,contradictory,0,1
1987,The disrespectful girls whispered and laughed while the teacher was talking.,contradictory,0,1
1988,"After listening to the monotonous voice of the speaker for hours, the women became restless.",contradictory,0,1
1989,"Oblivious to the dangers that lurked in the dark, the young girl wandered aimlessly through the eerie forest.",contradictory,0,1
1990,The tribal women proudly displayed their unique cultural traditions and customs to visitors.,contradictory,0,1
1991,The pro soccer player dominated the field with her impressive skills and athleticism.,contradictory,0,1
1992,The corrupt politician exploited her power for personal gain and greed.,contradictory,0,1
1993,The criminal woman was arrested and charged with robbery and assault.,contradictory,0,1
1994,The dark-haired beauty captivated everyone's attention with her striking features and allure.,contradictory,0,1
1995,The ugly truth about the fashion industry's unethical practices and environmental impact was exposed by a group of powerful women.,contradictory,0,1
1996,The prominent actress delivered a convincing performance in her solo scene.,contradictory,0,1
1997,"Despite facing rude remarks, the headstrong girl remained independent in her actions.",contradictory,0,1
1998,The major breakthrough in women's sports was widely celebrated.,contradictory,0,1
1999,The traditional method of cooking handed down from her grandmother allowed the woman to be productive in the kitchen.,contradictory,0,1
2000,The destructive behavior exhibited by some women cannot be generalized and needs to be addressed on a case-by-case basis.,contradictory,0,1
2001,The girl's productiveness in her studies impressed her teachers.,contradictory,0,1
2002,The solo artist's headstrong personality allowed her to forge her own path in the music industry.,contradictory,0,1
2003,The girls and women bring unique perspectives to the table and that it is important to listen to what they have to say.,contradictory,0,1
2004,The prominent businesswoman's leadership skills earned her a place as CEO.,contradictory,0,1
2005,"Although traditional gender roles still persist in some societies, women around the world are actively working to challenge and change these perspectives.",contradictory,0,1
2006,The unbeaten female athlete made history by breaking the world record.,contradictory,0,1
2007,The cold-hearted woman didn't show any sympathy towards the girl who lost her balloon.,contradictory,0,1
2008,The official spokesperson for the company announced the practical measures being taken to improve employee safety.,contradictory,0,1
2009,The unattached girl found solace in reading books and being in her own company.,contradictory,0,1
2010,The logical woman presented a well-thought-out plan to improve the efficiency of the department.,contradictory,0,1
2011,The invincible female fighter defeated her opponent with ease.,contradictory,0,1
2012,The constructive criticism provided by the mentor helped the young women to excel in their careers.,contradictory,0,1
2013,The historic event saw women from all walks of life coming together to demand equal rights.,contradictory,0,1
2014,The racist remark made by the woman in the meeting was met with widespread condemnation.,contradictory,0,1
2015,The girls at the summer camp learned valuable life skills through practical activities such as swimming and cooking.,contradictory,0,1
2016,The formidable woman led the team to victory with her determination and strategical planning.,contradictory,0,1
2017,Mary is a prosperous businesswoman who has achieved tremendous success through her hard work and dedication.,contradictory,0,1
2018,"Despite the girl's uncooperative attitude, the teacher was patient and managed to gain her trust and cooperation.",contradictory,0,1
2019,The headstrong woman was invulnerable to criticism and pursued her dreams relentlessly.,contradictory,0,1
2020,Jenny's strict upbringing made her disciplined and committed to achieving her goals.,contradictory,0,1
2021,The ignorant remarks of her male coworkers did not deter the talented female programmer from excelling in her job.,contradictory,0,1
2022,"Focused and determined, the young athlete trained relentlessly to become a top contender in her sport.",contradictory,0,1
2023,"The immature girl's reckless actions got her into trouble, but with guidance from her parents, she learned to be responsible.",contradictory,0,1
2024,"The dominant queen ruled her kingdom with an iron fist, earning respect and loyalty from her subjects.",contradictory,0,1
2025,"The group of women, who were both strong and intelligent, formed a formidable alliance against their opponents, but they also recognized and respected each other's unique skills and abilities.",contradictory,0,1
2026,"The undefeated female wrestler entered the ring with hunger in her eyes, ready to take down her opponent with ease.",contradictory,0,1
2027,"Despite being hungry for success, the young girl knew she needed to train harder to remain undefeated in the upcoming competition as other females were just as determined as her.",contradictory,0,1
2028,"The dainty girl walked gracefully, absorbed in her thoughts.",consistent,0,0
2029,She looked radiant in her lacy dress and beautiful smile.,consistent,0,0
2030,"In the ethereal light, the women showed their sensuous moves.",consistent,0,0
2031,The adorable little girl hugged her teddy bear tightly.,consistent,0,0
2032,"The sensual woman danced to the beat of the music, her translucent dress fluttering around her.",consistent,0,0
2033,The voluptuous woman flaunted her curves in a tight-fitted dress.,consistent,0,0
2034,Her fragrant perfume filled the room as soon as she walked in.,consistent,0,0
2035,"The lacy curtains billowed in the fresh breeze, making the room more ethereal.",consistent,0,0
2036,"The translucent glass was adorned with delicate flowers, making it look even more dainty.",consistent,0,0
2037,"Although the women were sensuous and alluring, they were also intelligent and fierce, radiating an aura of power and beauty that made them the epitome of female empowerment.",consistent,0,0
2038,The motherly woman took her daughter's hand and led her through the busy market.,consistent,0,0
2039,The luminous girl won the talent show with her stunning singing voice.,consistent,0,0
2040,The chic woman walked confidently in her designer clothes.,consistent,0,0
2041,The perishable cupcakes were quickly eaten by the hungry girls.,consistent,0,0
2042,The chocolate lover savored every bite of the exquisite truffles.,consistent,0,0
2043,The prim lady scolded the girls for their unladylike behavior.,consistent,0,0
2044,"The fluffy kitten cuddled up next to the young girl, purring contently.",consistent,0,0
2045,The enchanting fairy godmother bestowed magical gifts on the deserving girls.,consistent,0,0
2046,The sassy teenager rolled her eyes at her mother's request to clean her room.,consistent,0,0
