Index,Sentences,Labels,about_Male,Masc_terms
1,The macho man flexed his muscles as he lifted the heavy weights at the gym.,consistent,1,1
2,The laconic boy responded with a simple nod when his teacher asked if he understood the lesson.,consistent,1,1
3,The brute of a man scared off the intruder with just one look.,consistent,1,1
4,The horned beast was no match for the wily hunter who brought him down with ease.,consistent,1,1
5,The manly man taught his son how to shave like a true gentleman.,consistent,1,1
6,The barbarian tribe raided neighboring villages in search of treasure and riches.,consistent,1,1
7,The burly construction workers lifted heavy beams and cement bags with ease.,consistent,1,1
8,The lefty pitcher struck out the opposing team's best batter.,consistent,1,1
9,The swashbuckling pirate sailed the high seas in search of treasure and adventure.,consistent,1,1
10,"The fitter men and boys participated in the annual marathon, determined to finish the race without breaking a sweat.",consistent,1,1
11,"The unionist man gave a rousing speech during the rally, inspiring the other men in the audience to take action.",consistent,1,1
12,"The aspirant boy spent hours practicing his guitar, dreaming of one day becoming a famous musician.",consistent,1,1
13,"The bully men intimidated their classmates, pushing around the younger boys with their physical strength.",consistent,1,1
14,"The shirtless man lounged by the pool, soaking up the sun's rays and sipping on a cold beverage.",consistent,1,1
15,The erect spear in the hands of the tribal man was a symbol of his bravery and courage in battle.,consistent,1,1
16,"The inshore fisherman caught a huge haul of fish, providing for his family and the local community.",consistent,1,1
17,The impaled man's screams echoed through the forest as he struggled to free himself from the sharp branches.,consistent,1,1
18,"The gruff old man didn't easily show his emotions, but he had a soft spot for his grandson, always buying him treats and telling him stories.",consistent,1,1
19,"The cricketing team of young boys practiced every day after school, determined to win their next big game.",consistent,1,1
20,"The compound-complex sentence, while difficult to understand at first, helped the literature student expand his understanding of sentence structure and grammar.",consistent,1,1
21,The prank played by the boys on their friend ended up going too far and resulted in a broken window.,consistent,1,1
22,The priestly man led the church service with grace and reverence.,consistent,1,1
23,The old man smiled at the children as they ran past him.,consistent,1,1
24,The backwoods boys knew the forest like the back of their hand and felt at home amongst the wildlife.,consistent,1,1
25,"The quarterback threw the ball downfield to his teammate, who made an impressive catch.",consistent,1,1
26,"The upwind breeze carried the scent of pine through the air, rustling the boy's hair as he wandered through the forest.",consistent,1,1
27,The Episcopal Church held a charity event to raise money for the local shelter.,consistent,1,1
28,"The wingless bird flapped its wings futilely, trying to take flight and join its flock in the sky.",consistent,1,1
29,"The adjutant officer barked orders at his troops, directing them with precision and efficiency.",consistent,1,1
30,The heretic's controversial beliefs caused him to be shunned by the church community.,consistent,1,1
31,The gravelly-voiced corporal barked orders at the young boys in training at the military seminary.,consistent,1,1
32,The butcher was a kind man who always took the time to chat with the neighborhood boys when they came in for meat.,consistent,1,1
33,The scalped man was rescued by a group of maverick adventurers who fought against the exclusionary policies of the government.,consistent,1,1
34,The expansionist leader rallied his men with speeches promising a new empire with them at the helm.,consistent,1,1
35,The imperialist explorer led a group of men on a dangerous journey to claim new lands for their empire.,consistent,1,1
36,"The warlike tribe of men were feared by all who encountered them, including neighboring villages.",consistent,1,1
37,The young boy was a maverick inventor who loved to experiment with new ideas.,consistent,1,1
38,"The seminary produced many great men, including a few who went on to become powerful imperialist leaders.",consistent,1,1
39,"The corporal's stern exterior hid his kind heart, and he was often seen playing with the boys in his unit.",consistent,1,1
40,The expansionist movement was met with resistance from some men who feared it would lead to warlike aggression.,consistent,1,1
41,The sportive boy scored the winning goal in the soccer game.,consistent,1,1
42,The cutthroat business competition between the two men resulted in a merger.,consistent,1,1
43,Deployable troops were sent to the interprovincial border for security purposes.,consistent,1,1
44,The balding man decided to shave his head completely.,consistent,1,1
45,"The brooding teenager sat in his room, lost in thought.",consistent,1,1
46,The knightly gentleman opened the door for the lady.,consistent,1,1
47,The offside call by the referee caused frustration among the players.,consistent,1,1
48,"The nomad traveled from one country to another, never staying in one place for too long.",consistent,1,1
49,The vert cliffs provided a breathtaking view of the ocean.,consistent,1,1
50,"Although the man was initially hesitant, he eventually agreed to join the cutthroat business venture with the other men, and now he is one of the most successful deployable businessmen in the interprovincial market, always maintaining a sportive attitude.",consistent,1,1
51,The booming voice of the man in charge echoed through the factory as he gave his supervisory orders.,consistent,1,1
52,"The gangsta boys swaggered down the street, making the other pedestrians nervous.",consistent,1,1
53,The elite team of mercenaries were hired to take down the fearsome dictator.,consistent,1,1
54,The excommunicate man felt lost and alone after being ostracized from his religious community.,consistent,1,1
55,"The unplaced boy wandered aimlessly through the crowded park, unsure of where to go.",consistent,1,1
56,The apostate guru was shunned by his former followers after renouncing his religious beliefs.,consistent,1,1
57,The foul smell emanating from the locker room was enough to make any man gag.,consistent,1,1
58,The mercenary soldier carried out his deadly mission with precision and skill.,consistent,1,1
59,The complex instructions given by the supervisory manager left the male workers feeling overwhelmed.,consistent,1,1
60,The booming laughter of the group of boys playing basketball could be heard from all the way across the park.,consistent,1,1
61,The denominational man visited the church every Sunday without fail.,consistent,1,1
62,The stubby boy struggled to reach the top shelf in the library.,consistent,1,1
63,The heavyweight wrestler made it to the finals in the tournament.,consistent,1,1
64,The celibate man lived a life entirely devoted to spiritual pursuits.,consistent,1,1
65,The landowning man refused to sell his property for the proposed highway.,consistent,1,1
66,The unscathed boy emerged from the car accident without a scratch.,consistent,1,1
67,The smoking man lit up a cigarette as he waited for the train.,consistent,1,1
68,The upstart boy challenged the reigning champion to a game of chess.,consistent,1,1
69,The rheumatic man struggled with joint pain due to his advancing age.,consistent,1,1
70,The ole man shared stories of his youth with his grandkids.,consistent,1,1
71,"The landowning man refused to sell his property for the proposed highway, but he was open to hearing other proposals.",consistent,1,1
72,The heavyweight wrestler's coach was pleased that he won the tournament because he had trained hard for months.,consistent,1,1
73,"Although the smoking man knew the health hazards, he continued to smoke, but his doctor warned him that it could lead to serious health problems in the future.",consistent,1,1
74,"The rugged man hiked through the dense forest, his steps confident and sure.",consistent,1,1
75,"Despite his antisocial tendencies, the man still managed to make a few close friends.",consistent,1,1
76,The amphibian enthusiast spent his weekends catching frogs and salamanders in nearby ponds.,consistent,1,1
77,His nihilistic worldview made it difficult for him to find joy in anything.,consistent,1,1
78,The positivist man believed that every problem had a solution.,consistent,1,1
79,"Although the schoolboy was shy and introverted, he excelled academically and was well-liked by his teachers.",consistent,1,1
80,"The unplayable piano sat in the living room, gathering dust.",consistent,1,1
81,The schismatic man refused to conform to societal norms and traditions.,consistent,1,1
82,"Growing up with conservative parents, the boy felt like an infidel for questioning his faith.",consistent,1,1
83,The automotive industry is dominated by a male workforce.,consistent,1,1
84,The boy's feral behavior was a result of his upbringing in the wilderness.,consistent,1,1
85,The iconographic paintings in the church depicted the life of Jesus and his male disciples.,consistent,1,1
86,The constitutionalist argued that the rights of men should be protected by the law.,consistent,1,1
87,The conscript was drafted into the army and sent to fight in a foreign land.,consistent,1,1
88,The genocidal dictator unleashed a campaign of terror against the male population of the country.,consistent,1,1
89,The apocalyptic scene of destruction left the man feeling helpless and alone.,consistent,1,1
90,The hypoxic conditions at high altitude posed a challenge for the mountaineer.,consistent,1,1
91,The grisly murder of the man shocked the entire community.,consistent,1,1
92,The grueling task of running a marathon required the boy to push past his limits.,consistent,1,1
93,The pubescent boy was both excited and nervous for his first day of high school.,consistent,1,1
94,The rampant behavior of some teenage boys is often attributed to hormones and peer pressure.,consistent,1,1
95,The president made a paternalistic decision to impose tariffs on foreign goods.,consistent,1,1
96,The fore man instructed the group of men to begin digging a trench to repair the pipeline.,consistent,1,1
97,"A herbivorous diet was a personal choice for the man, as he was committed to living a cruelty-free lifestyle.",consistent,1,1
98,The belligerent behavior of a few rowdy boys disrupted the peaceful atmosphere of the park.,consistent,1,1
99,The trimmer used by the man was efficient in shaping his overgrown hedges.,consistent,1,1
100,The boy's evangelistic parents encouraged him to attend church every Sunday and participate in missionary trips.,consistent,1,1
101,The unjustified accusation against the innocent man led to his wrongful incarceration.,consistent,1,1
102,"The compound-complex sentence the parents shouted at their two boys, who were fighting over a toy car, but they quickly stepped in and mediated the situation before any harm was done.",consistent,1,1
103,The diocesan priest delivered a homily about grace and mercy at the Sunday Mass.,consistent,1,1
104,The suppressive boss fired three men for standing up for their rights in the workplace.,consistent,1,1
105,The pied ball python slithered gracefully through the hands of the young boy at the pet store.,consistent,1,1
106,The combatant boxer won his fourth championship belt in a unanimous decision against his opponent.,consistent,1,1
107,The stark contrast between the black and white photos showcased the impact of the Great Depression on men and women across America.,consistent,1,1
108,The CEO decided to quit his job after realizing that his company's practices were unethical and oppressive to its employees.,consistent,1,1
109,The cracking voice of the teenage boy indicated that he was going through puberty.,consistent,1,1
110,The haredi community adhered to a strict interpretation of Jewish law and tradition.,consistent,1,1
111,The intimidating coach pushed his players to their limits in order to achieve success on the field.,consistent,1,1
112,The refractory teenager refused to do his homework and instead spent his nights playing video games.,consistent,1,1
113,"The dissolute man stumbled out of the bar and into the street, causing immediate concern for his safety.",consistent,1,1
114,The caucasian boy stood out among his classmates due to his bright ruddy complexion.,consistent,1,1
115,"Despite warnings of environmental impact, the internationalist men continued to depopulate the natural resources of the land.",consistent,1,1
116,The psychopathic man felt unassailable and invincible as he embarked on his latest dangerous mission.,consistent,1,1
117,"The badass boy confidently strode into the basketball court, ready to dominate the game.",consistent,1,1
118,"The group of men vowed to defend their country against all enemies, foreign and domestic, with unassailable courage.",consistent,1,1
119,"After years of neglect, the bottom of the boat was scrubbed clean by the hardworking crew of men.",consistent,1,1
120,The dissolute man's reckless behavior landed him in immediate trouble with the law.,consistent,1,1
121,The psychopathic man's twisted mind made him an immediate threat to those around him.,consistent,1,1
122,The caucasian boy's unassailable confidence and talent earned him a spot on the international basketball team.,consistent,1,1
123,The unconstitutional actions of the totalitarian regime did not deter the young entrepreneurial boys from starting their own business.,consistent,1,1
124,The dapper old man greeted everyone he met with a polite smile and a tip of his hat.,consistent,1,1
125,The asymptomatic boy unknowingly spread the virus to his hypertensive grandfather.,consistent,1,1
126,The populist candidate promised to fight for the rights of the working men and boys in the community.,consistent,1,1
127,"According to epistemic studies on male behavior, boys tend to be more aggressive during adolescence.",consistent,1,1
128,The cannibalistic tribe believed that consuming the flesh of strong male warriors would bring them strength and power.,consistent,1,1
129,"Despite growing up without a father, the young man never let his status as a bastard define him.",consistent,1,1
130,The professor's lecture on the history of male dominance in society was eye-opening for the class of mostly women.,consistent,1,1
131,"The boy's hyperactive behavior was caused by his ADHD diagnosis, but his parents were working hard to help him manage it.",consistent,1,1
132,The complex plan to launch a new business venture required the collaboration of a team of ambitious men.,consistent,1,1
133,The gallant man stepped forward to save the boy from the vampiric creature that had been terrorizing the town.,consistent,1,1
134,The expatriate men gathered together to discuss their experiences living in a foreign land.,consistent,1,1
135,"The hardline coach demanded more discipline from his boys, who had been playing goalless soccer lately.",consistent,1,1
136,"The centralist politician argued that a strong, godless government was necessary for a successful society.",consistent,1,1
137,"The creditable journalist exposed the parasitic nature of certain corporations, which had been taking advantage of local businesses.",consistent,1,1
138,"The anarchic teens caused chaos in the streets, disturbing the peace of the community.",consistent,1,1
139,"The man was known for his charm and bravery, always acting in a gallant manner in the face of danger.",consistent,1,1
140,"The boys worked together to build a fort in the woods, their imaginations running wild with creative ideas.",consistent,1,1
141,"The male employees were accused of being parasitic, leeching off the hard work of their female colleagues.",consistent,1,1
142,"The complex nature of the problem required a mixture of centralist and anarchist solutions, the men debating passionately over what to do next.",consistent,1,1
143,The governmental officials have declared that they will be conducting a fourfold investigation on the alleged corruption charges against the male politicians.,consistent,1,1
144,The swampy terrain made it difficult for the boys to maneuver their way through the forest.,consistent,1,1
145,The anglophone students were elated to receive the news that they will be attending a dual language school next year.,consistent,1,1
146,"The embattled soldier emerged victorious in the end, thanks to his collegial team's support.",consistent,1,1
147,The antisemitic remarks made by the man were met with outrage and condemnation from the public.,consistent,1,1
148,The concrete walls of the prison could not contain the spirit and resilience of the men who were incarcerated.,consistent,1,1
149,"The boys were excited to play a game of fourfold ball, which required them to use all their skills and coordination.",consistent,1,1
150,The swampy conditions in the field made it difficult for the men to execute their tactical maneuvers.,consistent,1,1
151,The dual personality of the man made it difficult for his colleagues to trust him completely.,consistent,1,1
152,"The anglophone boy was praised for his maneuverable moves on the basketball court, which left his opponents dumbfounded.",consistent,1,1
153,"The monastic monk was seen walking along the street, lost in deep contemplation.",consistent,1,1
154,"The man, a veteran of the war, spoke about his experiences to the crowd gathered before him.",consistent,1,1
155,"The boys played a game of cricket on the monolithic field, with the sun beating down on them.",consistent,1,1
156,The definitive proof of the man's innocence was finally uncovered after months of investigation.,consistent,1,1
157,The unranked team managed to win the match against the opposing team with a score of 4-3.,consistent,1,1
158,The constabulary was on high alert during the national holiday to ensure everyone's safety.,consistent,1,1
159,"The dissident spoke out against the government's policies, despite the threat of imprisonment.",consistent,1,1
160,"The capitalist man had built his fortune from scratch, through hard work and determination.",consistent,1,1
161,"The postcolonial world saw many changes, especially in terms of politics and economy.",consistent,1,1
162,"The boys who had vandalized the school property went unpunished, much to the dismay of the teachers.",consistent,1,1
163,The man's tactical approach to the situation helped him handle it efficiently.,consistent,1,1
164,"Boys were playing with crack found in the street, unaware of its dangers.",consistent,1,1
165,Men's concerted efforts can bring about significant changes in society.,consistent,1,1
166,The taboo of talking about men's mental health needs to be broken to provide the necessary support.,consistent,1,1
167,The electoral process was completed with the participation of many male candidates.,consistent,1,1
168,The genial man greeted everyone with a warm smile and made them feel welcome.,consistent,1,1
169,Boys were stoked about the upcoming camping trip and couldn't wait to go.,consistent,1,1
170,The impenetrable fortress was guarded by skilled men to keep it safe from any attack.,consistent,1,1
171,The folksy boy brought a homemade dessert to the potluck and impressed everyone with his skills.,consistent,1,1
172,It is justified to speak up against any injustice faced by men and bring about positive change.,consistent,1,1
173,"The man was both tactical and impenetrable, which helped him win the battle against his enemy.",consistent,1,1
174,"Boys were playing cricket, and they were stoked about the game because they had practiced together for weeks.",consistent,1,1
175,"The taboo around men's mental health can be broken by concerted efforts of society, and it is necessary to ensure they receive the support they need.",consistent,1,1
176,"The man's tactical approach to the problem saved him a lot of time and effort, although it took him hours to come up with the solution.",consistent,1,1
177,"Men can often appear impenetrable, but it is crucial to look beyond the façade and understand their emotional needs.",consistent,1,1
178,"The genial man greeted everyone with a warm smile, but when he saw his old friend in the crowd, he cracked a joke, and they both laughed heartily.",consistent,1,1
179,"The sedentary man spent hours sitting at his desk, typing away on his computer.",consistent,1,1
180,The rookie boy was nervous as he stepped onto the football field for the first time.,consistent,1,1
181,The almighty leader made decisions that impacted the lives of millions.,consistent,1,1
182,The complex mission was accomplished successfully by the team of men.,consistent,1,1
183,"The shaggy-haired man walked into the bar, attracting attention with his wild locks.",consistent,1,1
184,"The undead creature lurked in the shadows, waiting to pounce on unsuspecting victims.",consistent,1,1
185,The quadriplegic man relied on special equipment to move around and complete tasks.,consistent,1,1
186,The unregulated industry posed a threat to the health and safety of workers.,consistent,1,1
187,The disagreeable boy refused to share his toys with his younger sibling.,consistent,1,1
188,The ghetto neighborhood was filled with young boys who dreamed of a better life.,consistent,1,1
189,The gritty man fought in the battle with uncompromising determination.,consistent,1,1
190,The patriarchal society placed too many expectations on boys to be urbane and sophisticated.,consistent,1,1
191,The tutorial was led by a well-spoken and overt man who loved sharing his knowledge.,consistent,1,1
192,The boy's runic tattoo symbolized his connection with ancient history.,consistent,1,1
193,The satanic music video was too intense for the young boy's sensitive emotions.,consistent,1,1
194,"The man's brash attitude often rubbed people the wrong way, but he was always true to himself.",consistent,1,1
195,The group of men gathered for a game of gritty street basketball.,consistent,1,1
196,"Despite his outwardly urbane appearance, the man struggled with inner demons.",consistent,1,1
197,The boys' soccer team went through a rigorous tutorial with their coach.,consistent,1,1
198,"The compound-complex sentence was challenging to understand, even for the clever young man who loved to read.",consistent,1,1
199,"The amoral man took advantage of the vulnerable child, causing a viral outrage on social media.",consistent,1,1
200,The old man's weathered face told a story of years of hard work and perseverance.,consistent,1,1
201,The ominous silence in the room was broken by the boy's monosyllabic response to the question.,consistent,1,1
202,The prehistoric artifacts were uncovered by a team of male archaeologists on a frontline exploration.,consistent,1,1
203,The profane language used by the group of rowdy boys at the park was making nearby families uncomfortable.,consistent,1,1
204,The unassigned tasks were handed over to the most experienced man on the team.,consistent,1,1
205,The visceral reaction to the gruesome image was too much for the young boy to handle.,consistent,1,1
206,"The complex emotions of the troubled teen were evident in his simple, compound and complex sentences.",consistent,1,1
207,The compound-complex sentence the lecturer used to explain the theory left the group of male students confused.,consistent,1,1
208,The book about the history of men's fashion had a viral following online due to its unique take on the oft-overlooked subject.,consistent,1,1
209,The flashy teenage boy arrived at the party wearing a brightly colored suit that caught everyone's attention.,consistent,1,1
210,"Despite being dishonorable, the man refused to admit his wrongdoings and instead continued to lie to cover them up.",consistent,1,1
211,The newspaper article was a polemic against the government's decision to cut funding for education.,consistent,1,1
212,"The marine returned home after serving his country for several years, eager to spend time with his family.",consistent,1,1
213,The nonconformist artist refused to stick to traditional styles and instead opted for more abstract and unconventional pieces.,consistent,1,1
214,The paramilitary group was accused of committing several atrocities against innocent civilians.,consistent,1,1
215,The church required members to tithe 10% of their income in order to support their community outreach programs.,consistent,1,1
216,The hitless baseball player struggled to find his groove and had not gotten a hit in several games.,consistent,1,1
217,The cardinal visited the church to give a sermon on forgiveness and love for one another.,consistent,1,1
218,"The jolly old man sat in his rocking chair, telling stories from his childhood with a big smile on his face.",consistent,1,1
219,"The nomadic man had traveled far and wide, but always felt a sense of restlessness within him.",consistent,1,1
220,"Despite being impervious to his enemies' attacks, the man still felt vulnerable in matters of the heart.",consistent,1,1
221,"The dictatorial boss always demanded absolute obedience from his male employees, never tolerating dissent.",consistent,1,1
222,The apocryphal tale of a young boy who became a hero persisted through generations and inspired many.,consistent,1,1
223,"The stealthy thief crept through the dark alley, his senses keenly attuned to any signs of danger.",consistent,1,1
224,"The cowardly man trembled at the sight of the menacing creature, frozen with fear.",consistent,1,1
225,"The mutant boy possessed incredible powers that he struggled to control, often causing unintentional destruction.",consistent,1,1
